Author short Names;authors;articles
"Akhmetov, V; Khlamov, S; Tabakova, I; Hernandez, W; Hipolito, JIN; Fedorov, P";"Akhmetov, Volodymyr; Khlamov, Sergii; Tabakova, Iryna; Hernandez, Wilmar; Nieto Hipolito, Juan Ivan; Fedorov, Peter";New approach for pixelization of big astronomical data for machine vision purpose
Kim, H;Kim, Hyondong;Investigating the Mediating Role of Social Networking Service Usage on the Big Five Personality Traits and on the Job Satisfaction of Korean Workers
"Feng, S; Zhou, HY; Dong, HB";"Feng, Shuo; Zhou, Huiyu; Dong, Hongbiao";Using deep neural network with small dataset to predict material defects
"Tu, YQ; Lu, YQ; Chen, GH; Zhao, J; Yi, FL";"Tu, Yongqiu; Lu, Yiqiang; Chen, Guohua; Zhao, Jie; Yi, Faling";Architecture Design of Distributed Medical Big Data Platform Based on Spark
"Hasanin, T; Khoshgoftaar, TM; Leevy, JL";"Hasanin, Tawfiq; Khoshgoftaar, Taghi M.; Leevy, Joffrey L.";A Comparison of Performance Metrics with Severely Imbalanced Network Security Big Data
Zakzak, L;Zakzak, Lama;Citizen-centric Smart City Development: The Case of Smart Dubai's Happiness Agenda
"Korunoski, M; Gushev, M";"Korunoski, Mladen; Gushev, Marjan";Evaluating the Scalability of a Big Data IoT Cloud Solution
"Young, AD; Gillung, JP";"Young, Andrew D.; Gillung, Jessica P.";Phylogenomics - principles, opportunities and pitfalls of big-data phylogenetics
"Mujumdar, A; Vaidehi, V";"Mujumdar, Aishwarya; Vaidehi, V.";Diabetes Prediction using Machine Learning Algorithms
"Malik, BH; Maryam, M; Khalid, M; Khlaid, J; Rehman, NAU; Sajjad, SI; Islam, T; Butt, UA; Raza, A; Nasr, MS";"Malik, Babur Hayat; Maryam, Maliha; Khalid, Myda; Khlaid, Javaria; Rehman, Naj Am Ur; Sajjad, Syeda Iqra; Islam, Tanveer; Butt, Umair Ahmed; Raza, Ali; Nasr, M. Saad";Fast and Efficient In-Memory Big Data Processing
"Melnykova, N; Shakhovska, N; Ml, MG; Melnykov, V";"Melnykova, Nataliia; Shakhovska, Natalia; Ml, Michal Gregus; Melnykov, Volodymyr";Using Big Data for Formalization the Patient's Personalized Data
"Zhang, JL; Wu, T; Fan, ZP";"Zhang, Jialin; Wu, Tong; Fan, Zhipeng";Research on Precision Marketing Model of Tourism Industry Based on User's Mobile Behavior Trajectory
"Riba, M; Sala, C; Toniolo, D; Tonon, G";"Riba, Michela; Sala, Cinzia; Toniolo, Daniela; Tonon, Giovanni";Big Data in Medicine, the Present and Hopefully the Future
"Chatterjee, S; Kar, AK; Mustafa, SZ";"Chatterjee, Sheshadri; Kar, Arpan Kumar; Mustafa, Syed Ziaul";Securing IoT devices in smart cities of India: from ethical and enterprise information system management perspective
"Ahmad, K; Zheng, JM; Rafi, M";"Ahmad, Khurshid; Zheng JianMing; Rafi, Muhammad";Librarian's perspective for the implementation of big data analytics in libraries on the bases of lean-startup model
"Dong, DD; He, R; Xiong, GX";"Dong, Doudou; He, Rui; Xiong, Guixi";Foreign Commodity Sales Forecast Based on Model Fusion
"Nousias, S; Lalos, AS; Kalogeras, A; Alexakos, C; Koulamas, C; Moustakas, K";"Nousias, Stavros; Lalos, Aris S.; Kalogeras, Athanasios; Alexakos, Christos; Koulamas, Christos; Moustakas, Konstantinos";Sparse modeling and optimization tools for energy efficient and reliable IoT
"Kumar, R; Kumar, S; Tiwari, SK";"Kumar, Ranjan; Kumar, Subhash; Tiwari, Sanjay K.";A study of software reliability on big data open source software
"Bhattacharjee, S; Chakkaravarthy, M; Chakkaravarthy, DM";"Bhattacharjee, Shiladitya; Chakkaravarthy, Midhun; Chakkaravarthy, Divya Midhun";GPU-Based Integrated Security System for Minimizing Data Loss in Big Data Transmission
"Corrales-Garay, D; Ortiz-de-Urbina-Criado, M; Mora-Valentin, EM";"Corrales-Garay, Diego; Ortiz-de-Urbina-Criado, Marta; Mora-Valentin, Eva-Maria";Knowledge areas, themes and future research on open data: A co-word analysis
Tsou, MC;Tsou, Ming-Cheng;Big data analysis of port state control ship detention database
"Zafar, S; Hussain, R; Hussain, F; Jangsher, S";"Zafar, Saniya; Hussain, Rasheed; Hussain, Fatima; Jangsher, Sobia";Interplay between Big Spectrum Data and Mobile Internet of Things: Current solutions and future challenges
"Chen, MX; Geng, N";"Chen, Mingxuan; Geng, Nan";Research on Effective Teaching based on Students' Assessment Data Analysis
"Mahr, D; Dickel, S";"Mahr, Dana; Dickel, Sascha";Citizen science beyond invited participation: nineteenth century amateur naturalists, epistemic autonomy, and big data approaches avant la lettre
"Jing, XP; Wen, CY; Wang, WP; Feng, Y";"Jing, Xiao-ping; Wen, Cheng-yu; Wang, Wen-pu; Feng, Yong";A matching model for plant growth environment based on weighted multi-dimensional tree designed for big data
"Lulli, A; Oneto, L; Anguita, D";"Lulli, Alessandro; Oneto, Luca; Anguita, Davide";Mining Big Data with Random Forests
"Shayea, I; Abd Rahman, T; Azmi, MH; Han, CT; Arsad, A";"Shayea, Ibraheem; Abd Rahman, Tharek; Azmi, Marwan Hadri; Han, Chua Tien; Arsad, Arsany";Predicting required licensed spectrum for the future considering big data growth
"Lukasik, S; Lalik, K; Sarna, P; Kowalski, PA; Charytanowicz, M; Kulczycki, P";"Lukasik, Szymon; Lalik, Konrad; Sarna, Piotr; Kowalski, Piotr A.; Charytanowicz, Malgorzata; Kulczycki, Piotr";EFFICIENT ASTRONOMICAL DATA CONDENSATION USING APPROXIMATE NEAREST NEIGHBORS
"Rasheva-Yordanova, K; Toleva-Stoimenova, S; Christozov, D";"Rasheva-Yordanova, K.; Toleva-Stoimenova, S.; Christozov, D.";DATA SCIENCE: CHALLENGES AND TRENDS
Weldon, SP;Weldon, Stephen P.;Current Bibliography of the History of Science and Its Cultural Influences, 2019
Moridpour, S;Moridpour, Sara;Big Data Analytics in Traffic and Transportation Engineering: Emerging Research and Opportunities Preface
"Mauch, M; Eifrig, C; Kahn, P; Koch, A; Klute, S; Kretzschmar, J; Opplozer, T; Schau, V; Rossak, W";"Mauch, Marianne; Eifrig, Clemens; Kahn, Philipp; Koch, Alexander; Klute, Steffen; Kretzschmar, Johannes; Opplozer, Thomas; Schau, Volkmar; Rossak, Wilhelm";Distributed Agent-Based Big Data Network for Secure E-Mobility TCO Analysis: A Use Case for Multi-Agent Systems in Logistics Environment
"Greene, T; Shmueli, G; Ray, S; Fell, J";"Greene, Travis; Shmueli, Galit; Ray, Soumya; Fell, Jan";Adjusting to the GDPR: The Impact on Data Scientists and Behavioral Researchers
"Bajenaru, OL; Custura, AM";"Bajenaru, Ovidiu-Lucian; Custura, Adrian-Mihai";Enhanced framework for an elderly-centred platform: Big Data in Monitoring the Health Status
"Li, SQ; He, HW; Li, JW";"Li, Shuangqi; He, Hongwen; Li, Jianwei";Big data driven lithium-ion battery modeling method based on SDAE-ELM algorithm and data pre-processing technology
"Devi, AS; Maragatham, G";"Devi, A. Shobana; Maragatham, G.";Big Genome Data Classification with Random Forests Using VariantSpark
"Aggs, SH; Randewijk, PJ; Knutz, BC; Kristensen, AS";"Aggs, Simon Hojstrup; Randewijk, Peter Jan; Knutz, Boye Cornils; Kristensen, Anders Steen";Big Data Analysis with Key Performance Indicators for Reactive Power Balance and Associated Voltage Quality Visual Mapping in the North-Western Part of the Danish Grid
Pasidis, I;Pasidis, Ilias;Congestion by accident? A two-way relationship for highways in England
"Garain, U; Halder, B";"Garain, Utpal; Halder, Biswajit";Even big data is not enough: need for a novel reference modelling for forensic document authentication
Yoshiura, H;Yoshiura, Hiroshi;Re-identifying people from anonymous histories of their activities
"Colladon, AF; Guardabascio, B; Innarella, R";"Colladon, Andrea Fronzetti; Guardabascio, Barbara; Innarella, Rosy";Using social network and semantic analysis to analyze online travel forums and forecast tourism demand
"Huang, ZB; Wang, JW; Fu, X";"Huang Zebin; Wang Jianwei; Fu Xin";Design and Implementation of Eco-city Commuting Analysis System Based on Spatio-temporal Big Data
"Luo, F; Jiang, CX; Yu, S; Wang, JJ; Li, YP; Ren, Y";"Luo, Feng; Jiang, Chunxiao; Yu, Shui; Wang, Jingjing; Li, Yipeng; Ren, Yong";Stability of Cloud-Based UAV Systems Supporting Big Data Acquisition and Processing
"Mishra, D; Luo, ZW; Hazen, B; Hassini, E; Foropon, C";"Mishra, Deepa; Luo, Zongwei; Hazen, Benjamin; Hassini, Elkafi; Foropon, Cyril";Organizational capabilities that enable big data and predictive analytics diffusion and organizational performance A resource-based perspective
"Wang, BB; Yang, B; Shan, SS; Chen, HC";"Wang, Beibei; Yang, Bo; Shan, Shuangshuang; Chen, Hechang";Detecting Hot Topics From Academic Big Data
"Wang, CYP; Lien, MC; Jaw, BS; Wang, CY; Yeh, YS; Kung, SH";"Wang, Christina Yu-Ping; Lien, Man-Chun; Jaw, Bih-Shiaw; Wang, Chen-Yu; Yeh, Yi-Shien; Kung, Shu-Hung";Interrelationship of expatriate employees' personality, cultural intelligence, cross-cultural adjustment, and entrepreneurship
"Song, J; Song, TM";"Song, Juyoung; Song, Tae Min";Social Big-Data Analysis of Particulate Matter, Health, and Society
"Zhao, F; Shi, WQ; Gan, Y; Peng, ZR; Luo, XY";"Zhao, Fan; Shi, Wenqi; Gan, Yong; Peng, Ziru; Luo, Xiangyang";A localization and tracking scheme for target gangs based on big data of Wi-Fi locations
"Khorasani, SO; Rellermeyer, JS; Epema, D";"Khorasani, Sobhan Omranian; Rellermeyer, Jan S.; Epema, Dick";Self-adaptive Executors for Big Data Processing
"Rezankova, H; Novak, R";"Rezankova, Hana; Novak, Richard";EFFECT OF ORDINAL VARIABLE TRANSFORMATIONS ON HIERARCHICAL CLUSTERING RESULTS: A CASE STUDY ON THE BIG DATA PHENOMENON
"Xiong, HY; Liu, JX; Zhang, RH; Zhu, XL; Liu, H";"Xiong, Huiyuan; Liu, Jianxun; Zhang, Ronghui; Zhu, Xionglai; Liu, Huan";An Accurate Vehicle and Road Condition Estimation Algorithm for Vehicle Networking Applications
"Zhang, F; Wang, ZY; Li, Y; Zhang, CY";"Zhang, Fan; Wang, Zhengying; Li, Yang; Zhang, Chenyu";Research on Wireless Time Synchronization Technology of Multi-source Power Grid Based on Wireless Physical Layer
"Zhang, QM; Chen, N";"Zhang, Qimin; Chen, Ning";Reliability Analysis of Hydrogen Bubble Defects in Gas Pipeline Based on Big Data
"Cai, XH; Pratley, L; McEwen, JD";"Cai, Xiaohao; Pratley, Luke; McEwen, Jason D.";Online radio interferometric imaging: assimilating and discarding visibilities on arrival
"Muisyo, T; Bernardo, EO; Camazine, M; Colvin, R; Thomas, KA; Borgman, MA; Spinella, PC";"Muisyo, Teddy; Bernardo, Erika O.; Camazine, Maraya; Colvin, Ryan; Thomas, Kimberly A.; Borgman, Matthew A.; Spinella, Philip C.";Mortality prediction in pediatric trauma
"Visuwasam, LMM; Raj, DP";"Visuwasam, L. Maria Michael; Raj, D. Paul";A distributed intelligent mobile application for analyzing travel big data analytics
"Khatamian, A; Paull, EO; Califano, A; Yu, JY";"Khatamian, Alireza; Paull, Evan O.; Califano, Andrea; Yu, Jiyang";SJARACNe: a scalable software tool for gene network reverse engineering from big data
"Padillo, F; Luna, JM; Ventura, S";"Padillo, F.; Luna, J. M.; Ventura, S.";A Grammar-Guided Genetic Programing Algorithm for Associative Classification in Big Data
Shi, LP;Shi, Liping;Fuzzy Evaluation Model of Economic Loss in High Density Marine Traffic Accidents Based on Big Data Analysis
"Bhattacharjee, A; Barve, Y; Khare, S; Bao, SX; Kang, ZW; Gokhale, A; Damiano, T";"Bhattacharjee, Anirban; Barve, Yogesh; Khare, Shweta; Bao, Shunxing; Kang, Zhuangwei; Gokhale, Aniruddha; Damiano, Thomas";STRATUM: A BigData-as-a-Service for Lifecycle Management of IoT Analytics Applications
"Limkar, SV; Jha, RK";"Limkar, Suresh, V; Jha, Rakesh Kumar";A novel method for parallel indexing of real time geospatial big data generated by IoT devices
Bibri, SE;Bibri, Simon Elias;Novel Intelligence Functions for Data-driven Smart Sustainable Urbanism: Utilizing Complexity Sciences in Fashioning Powerful Forms of Simulations Models
MacEachren, AM;MacEachren, Alan M.;(re)Considering Bertin in the age of big data and visual analytics
"Ramsey, JD; Zhang, K; Glymour, C";"Ramsey, Joseph D.; Zhang, Kun; Glymour, Clark";The Evaluation of Discovery: Models, Simulation and Search through Big Data
"Maurer, H; Delilovic, N";"Maurer, Hermann; Delilovic, Namik";A Critical Discussion of Some Current and Future Developments of IT
"Zhao, YB; Xu, X; Wang, MS";"Zhao, Yabing; Xu, Xun; Wang, Mingshu";Predicting overall customer satisfaction: Big data evidence from hotel online textual reviews
"Leira, R; Gifre, L; Gonzalez, I; de Vergara, JEL; Aracil, J";"Leira, Rafael; Gifre, Lluis; Gonzalez, Ivan; Lopez de Vergara, Jorge E.; Aracil, Javier";Wormhole: a novel big data platform for 100 Gbit/s network monitoring and beyond
"Kong, XJ; Shi, YJ; Yu, S; Liu, JY; Xia, F";"Kong, Xiangjie; Shi, Yajie; Yu, Shuo; Liu, Jiaying; Xia, Feng";Academic social networks: Modeling, analysis, mining and applications
"Sacramento Gutierres, F; Torrente, AO; Torrent-Moreno, M";"Sacramento Gutierres, Francisco; Torrente, Antonio Ortiz; Torrent-Moreno, Marc";RESPONSIVE GEOGRAPHICAL INFORMATION SYSTEMS FOR SPATIO-TEMPORAL ANALYSIS OF MOBILE NETWORKS IN BARCELONA
"Holton, R; Boyd, R";"Holton, Robert; Boyd, Ross";'Where are the people? What are they doing? Why are they doing it?'(Mindell) Situating artificial intelligence within a socio-technical framework
"Wang, J; Yin, ZQ; Xu, XY; Yang, JF";"Wang, Jia; Yin, Zhiqin; Xu, Xiyan; Yang, Jianfei";Automatic Color Control Method of Low Contrast Image Based on Big Data Analysis
"Lyu, XZ; Cai, XJ; Zhou, P";"Lyu, Xiaozan; Cai, Xiaojing; Zhou, Ping";Collaboration Size and Citation Impact in Big Data Research
"Cui, ZH; Cao, Y; Cai, XJ; Cai, JH; Chen, JJ";"Cui, Zhihua; Cao, Yang; Cai, Xingjuan; Cai, Jianghui; Chen, Jinjun";Optimal LEACH protocol with modified bat algorithm for big data sensing systems in Internet of Things
"Hong, WX; Xiong, ZA; Zheng, NN; Weng, Y";"Hong, Wenxing; Xiong, Ziang; Zheng, Nannan; Weng, Yang";A Medical-History-Based Potential Disease Prediction Algorithm
"Malita, M; Popescu, GV; Stefan, GM";"Malita, Mihaela; Popescu, George Vladut; Stefan, Gheorghe M.";Heterogenous Computing for Markov Models in Big Data
"Pot, M; Spahl, W; Prainsack, B";"Pot, Mirjam; Spahl, Wanda; Prainsack, Barbara";The Gender of Biomedical Data: Challenges for Personalised and Precision Medicine
Koch, NM;Koch, Nicolas Mongiardino;The phylogenomic revolution and its conceptual innovations: a text mining approach
"Chiu, YC; Lin, HH; Jou, YT";"Chiu, Yi-Chuan; Lin, Hsing-Hung; Jou, Yung-Tsan";A Model Selection Method for Machine Learning by Differential Evolution
"Bethu, S; Madhavi, K; Rupa, B; Hanuman, AS; Soujanya, R; Babu, BS";"Bethu, Srikanth; Madhavi, K.; Rupa, B.; Hanuman, A. Sai; Soujanya, R.; Babu, B. Sankara";A Survey Report on Data Analytics as a Tool in PoliticalCampaign
"Francia, M; Gallinucci, E; Vitali, F";"Francia, Matteo; Gallinucci, Enrico; Vitali, Federico";Map-Matching on Big Data: a Distributed and Efficient Algorithm with a Hidden Markov Model
"Cong, TS; Wang, JJ; Guan, SH; Mu, YF; Bai, T; Ren, Y";"Cong, Tianshuo; Wang, Jingjing; Guan, Sanghai; Mu, Yifei; Bai, Tong; Ren, Yong";Big Data Driven Oriented Graph Theory Aided tagSNPs Selection for Genetic Precision Therapy
"Ding, ST; Qu, SR; Xi, YL; Wan, SH";"Ding, Songtao; Qu, Shiru; Xi, Yuling; Wan, Shaohua";A long video caption generation algorithm for big video data retrieval
"Wu, J; Tian, XM; Tan, YL";"Wu, Jia; Tian, Xiaoming; Tan, Yanlin";Hospital evaluation mechanism based on mobile health for IoT system in social networks
"Liu, Y; Bellay, Z; Bradsky, P; Chandler, G; Craig, B";"Liu, Ying; Bellay, Zachary; Bradsky, Payton; Chandler, Glen; Craig, Brandon";Edge-to-Fog Computing for Color-Assisted Moving Object Detection
"Liu, F; Yan, YH; Wang, LM; Yu, W; Li, XJ; Xu, B";"Liu, Fei; Yan, Yonghui; Wang, Liming; Yu, Wei; Li, Xinjia; Xu, Bo";Identification of crossed meters based on big data analysis
"Shan, SQ; Luo, YT; Zhou, Y; Wei, YG";"Shan, Siqing; Luo, Yiting; Zhou, Yuan; Wei, Yigang";Big data analysis adaptation and enterprises' competitive advantages: the perspective of dynamic capability and resource-based theories
Jiang, WX;Jiang, Wuxue;An Intelligent Supply Chain Information Collaboration Model Based on Internet of Things and Big Data
Thylstrup, NB;Thylstrup, Nanna Bonde;Data out of place: Toxic traces and the politics of recycling
"Das, T; Saha, G";"Das, Tanuja; Saha, Goutam";Addressing big data issues using RNN based techniques
"Montans, FJ; Chinesta, F; Gomez-Bombarelli, R; Kutz, JN";"Montans, Francisco J.; Chinesta, Francisco; Gomez-Bombarelli, Rafael; Kutz, J. Nathan";Data-driven modeling and learning in science and engineering
"Matsuda, K; Uesugi, S; Naruse, K; Morita, M";"Matsuda, Keishi; Uesugi, Shiro; Naruse, Kazuaki; Morita, Masahiro";Technologies of Production with Society 5.0
"Muller, M; Lange, I; Wang, D; Piorkowski, D; Tsay, J; Liao, QV; Dugan, C; Erickson, T";"Muller, Michael; Lange, Ingrid; Wang, Dakuo; Piorkowski, David; Tsay, Jason; Liao, Q. Vera; Dugan, Casey; Erickson, Thomas";How Data Science Workers Work with Data: Discovery, Capture, Curation, Design, Creation
"Gorban, AN; Makarov, VA; Tyukin, IY";"Gorban, Alexander N.; Makarov, Valeri A.; Tyukin, Ivan Y.";Symphony of high-dimensional brain Reply to comments on The unreasonable effectiveness of small neural ensembles in high-dimensional brain
"Yu, HW; Choi, JY; Park, YS; Park, HS; Choi, Y; Ahn, SH; Kang, E; Oh, HK; Kim, EK; Cho, JY; Kim, DW; Park, DJ; Yoon, YS; Kang, SB; Kim, HH; Han, HS; Lee, T";"Yu, Hyeong Won; Choi, June Young; Park, Young Suk; Park, Hyung Sub; Choi, Youngrok; Ahn, Sang-Hoon; Kang, Eunyoung; Oh, Heung-Kwon; Kim, Eun-Kyu; Cho, Jai Young; Kim, Duck-Woo; Park, Do Joong; Yoon, Yoo-Seok; Kang, Sung Bum; Kim, Hyung-Ho; Han, Ho-Seong; Lee, Taeseung";Implementation of a resident night float system in a surgery department in Korea for 6 months: electronic medical record-based big data analysis and medical staff survey
"Ciobanu, MG; Fasano, F; Martinelli, F; Mercaldo, F; Santone, A";"Ciobanu, Madalina G.; Fasano, Fausto; Martinelli, Fabio; Mercaldo, Francesco; Santone, Antonella";POSTER: A Data Life Cycle Modeling Proposal by means of Formal Methods
"Ji, YY; Xu, WH; Deng, AS";"Ji, Yuanyuan; Xu, Wenhai; Deng, Ansheng";A Study of Vessel Trajectory Compression Based on Vector Data Compression Algorithms
"Ottaviano, M; Cabrera-Umpierrez, MF; Arredondo, MT";"Ottaviano, Manuel; Fernanda Cabrera-Umpierrez, Maria; Teresa Arredondo, Maria";PULSE: Participatory Urban Living for Sustainable Environment
"Purandhar, N; Kumar, NMS";"Purandhar, N.; Kumar, N. M. Saravana";Review of Data Extraction, Segregation & Privacy with Big Data Analytics in the Online Health Care Systems
"Xiao, A; Lu, ZH; Li, JN; Wu, J; Hung, PCK";"Xiao, Ai; Lu, ZhiHui; Li, Junnan; Wu, Jie; Hung, Patrick C. K.";SARA: Stably and quickly find optimal cloud configurations for heterogeneous big data workloads
"Zhao, YN; Zhao, HW";"Zhao, Yanan; Zhao, Hongwei";Research on the Management Model of Marine Economic Information Resources in the Big Data Era Based on Cloud Computing
"Zha, Y; Nowak, E; Li, J";"Zha, Yue; Nowak, Etienne; Li, Jing";Liquid Silicon: A Nonvolatile Fully Programmable Processing -In -Memory Processor with Monolithically Integrated Re' M for Big Data/Machine Learning Applications
"Tossas-Milligan, KY; Winn, RA";"Tossas-Milligan, Katherine Y.; Winn, Robert A.";Breaking the Cycle of Health Inequities: The Bioethics of Data
Jiang, YH;Jiang, Yihuo;Improved Design of Classification Algorithm in Cloud Computing and Big Data Environment
"Cao, Y; Magerko, JA; Serna, R; Qin, SB; Pilawa-Podgurski, RCN; Krein, PT";"Cao, Yue; Magerko, John A., III; Serna, Rodrigo; Qin, Shibin; Pilawa-Podgurski, Robert C. N.; Krein, Philip T.";One Year Submillisecond Fast Solar Database: Collection, Investigation, and Application
"Cantabella, M; Martinez-Espana, R; Ayuso, B; Yanez, JA; Munoz, A";"Cantabella, Magdalena; Martinez-Espana, Raquel; Ayuso, Belen; Antonio Yanez, Juan; Munoz, Andres";Analysis of student behavior in learning management systems through a Big Data framework
"Talevi, A; Bellera, CL";"Talevi, Alan; Bellera, Carolina L.";Challenges and opportunities with drug repurposing: finding strategies to find alternative uses of therapeutics
Zhang, GM;Zhang Guoming;Website Information Extraction Method and Algorithms Based on Big Data Technology
"Gupta, S; Qian, XY; Bhushan, B; Luo, ZW";"Gupta, Shivam; Qian, Xiaoyan; Bhushan, Bharat; Luo, Zongwei";Role of cloud ERP and big data on firm performance: a dynamic capability view theory perspective
Xiong, XW;Xiong Xiao-wei;Study on the intelligent system of sports culture centers by combining machine learning with big data
"Forootani, A; Iervolino, R; Tipaldi, M";"Forootani, Ali; Iervolino, Raffaele; Tipaldi, Massimo";Applying unweighted least-squares based techniques to stochastic dynamic programming: theory and application
"Mohebali, B; Tahmassebi, A; Gandomi, AH; Meyer-Baese, A";"Mohebali, Behshad; Tahmassebi, Amirhessam; Gandomi, Amir H.; Meyer-Baese, Anke";A big data inspired preprocessing scheme for bandwidth use optimization in smart cities applications
"Shahabadkar, R; Reddy, SSS";"Shahabadkar, Ramesh; Reddy, S. Sai Satyanarayana";An Integrated Schema for Efficient Face Recognition in Social Networking Platforms
"Nahar, S; Zhong, T; Monday, HN; Mills, MO; Nneji, GU; Abubakar, HS";"Nahar, Saifun; Zhong, Ting; Monday, Happy N.; Mills, Michael O.; Nneji, Grace U.; Abubakar, Hassan S.";A Survey on Data Stream Mining Towards the Internet of Things Application
"Tutkun, NA; Koyuncu, N; Karabey, U";"Tutkun, Nihal Ata; Koyuncu, Nursel; Karabey, Ugur";Discrete-time survival analysis under ranked set sampling: an application to Turkish motor insurance data
"Munir, K; de Ramon-Fernandez, A; Iqbal, S; Javaid, N";"Munir, Kamran; de Ramon-Fernandez, Alberto; Iqbal, Sohail; Javaid, Nadeem";Neuroscience patient identification using big data and fuzzy logic-An Alzheimer's disease case study
"Alic, AS; Almeida, J; Aloisio, G; Andrade, N; Antunes, N; Ardagna, D; Badia, RM; Basso, T; Blanquer, I; Braz, T; Brito, A; Elia, D; Fiore, S; Guedes, D; Lattuada, M; Lezzi, D; Maciel, M; Meira, W; Mestre, D; Moraes, R; Morais, F; Pires, CE; Kozievitch, NP; dos Santos, W; Silva, P; Vieira, M";"Alic, Andy S.; Almeida, Jussara; Aloisio, Giovanni; Andrade, Nazareno; Antunes, Nuno; Ardagna, Danilo; Badia, Rosa M.; Basso, Tania; Blanquer, Ignacio; Braz, Tarciso; Brito, Andrey; Elia, Donatello; Fiore, Sandro; Guedes, Dorgival; Lattuada, Marco; Lezzi, Daniele; Maciel, Matheus; Meira Jr, Wagner; Mestre, Demetrio; Moraes, Regina; Morais, Fabio; Pires, Carlos Eduardo; Kozievitch, Nadia P.; dos Santos, Walter; Silva, Paulo; Vieira, Marco";BIGSEA: A Big Data analytics platform for public transportation information
"Martins, FLJ; Celestino, J; Gomes, RL; Patel, A; Agoulmine, N";"Martins, Francisco L. J.; Celestino Junior, Joaquim; Gomes, Rafael L.; Patel, Ahmed; Agoulmine, Nazim";BE-SYS: Big Data E-health system for analysis and detection of risk of septic shock in adult patients
"Sacca, D; Serra, E; Rullo, A";"Sacca, Domenico; Serra, Edoardo; Rullo, Antonino";Extending inverse frequent itemsets mining to generate realistic datasets: complexity, accuracy and emerging applications
"Chou, YC; Chao, CY; Yu, HY";"Chou, Yi-Chi; Chao, Chun-Yen; Yu, Han-Yen";A Resume Evaluation System Based on Text Mining
"Milan, S; Trere, E";"Milan, Stefania; Trere, Emiliano";Big Data from the South(s): Beyond Data Universalism
"Zhang, Y; Li, QZ; Wang, HY; Du, X; Huang, HP";"Zhang, Yuan; Li, Qiangzi; Wang, Hongyan; Du, Xin; Huang, Huiping";Community scale livability evaluation integrating remote sensing, surface observation and geospatial big data
"Ganglberger, F; Swoboda, N; Frauenstein, L; Kaczanowska, J; Haubensak, W; Buhler, K";"Ganglberger, Florian; Swoboda, Nicolas; Frauenstein, Lisa; Kaczanowska, Joanna; Haubensak, Wulf; Buehler, Katja";BrainTrawler: A visual analytics framework for iterative exploration of heterogeneous big brain data
"Boone, T; Ganeshan, R; Jain, A; Sanders, NR";"Boone, Tonya; Ganeshan, Ram; Jain, Aditya; Sanders, Nada R.";Forecasting sales in the supply chain: Consumer analytics in the big data era
"Du, GQ; Zheng, M; Wang, SJ";"Du Guangqian; Zheng Meng; Wang Shijie";Evaluation of Seismic Performance of Reinforced Concrete Frame Structures in the Context of Big Data
"Masciari, E; Sacca, D; Trubitsyna, I";"Masciari, Elio; Sacca, Domenico; Trubitsyna, Irina";An Effective System for User Queries Assistance
Zhan, G;Zhan, Ge;Online Forum Authenticity: Big Data Analytics in Healthcare
Stepien, M;Stepien, Marek;How New Technologies Can Change Our Approach to Audit
"Luo, X; Justice, C; Sorge, BH";"Luo, Xiao; Justice, Connie; Sorge, Brandon Herald";Integrated Education of Data Analytics and Information Security through Cross-Curricular Activities
"Lin, HY; Yang, SY";"Lin, Hsueh-Yuan; Yang, Sheng-Yuan";A cloud-based energy data mining information agent system based on big data analysis technology
Fahmi, I;Fahmi, Ismail;Keynote: Detecting and visualizing the operation of cyber troops and computational propaganda that shape public opinion during the KPK law revision process
"Liu, CK; Ni, Z; Wei, MX; Niehaus, A; Cao, D";"Liu, Chengkun; Ni, Ze; Wei, Mengxuan; Niehaus, Aaron; Cao, Dong";Automatic Big Data Acquisition of Electrical Parameters in Wide Bandgap Devices
"Giuliani, G; Camara, G; Killough, B; Minchin, S";"Giuliani, Gregory; Camara, Gilberto; Killough, Brian; Minchin, Stuart";Earth Observation Open Science: Enhancing Reproducible Science Using Data Cubes
"Souliotis, K; Golna, C; Kani, C; Nikolaidi, S; Boumpas, D";"Souliotis, Kyriakos; Golna, Christina; Kani, Chara; Nikolaidi, Sofia; Boumpas, Dimitrios";Real world, big data cost of pharmaceutical treatment for rheumatoid arthritis in Greece
"Chen, WH; Li, J; Li, XT; Zhang, LZ; Wang, JW";"Chen, Wanghu; Li, Jing; Li, Xintian; Zhang, Lizhi; Wang, Jianwu";Training Back Propagation Neural Networks in MapReduce on High-Dimensional Big Datasets With Global Evolution
