Author short Names;authors;articles
"Bonev, P; Soderberg, M";"Bonev, Petyo; Soderberg, Magnus";Big data in the energy industry
"Khalilian, M; Ehsaei, MA; TaheriFard, S";"Khalilian, Madjid; Ehsaei, Mahshid Alsadat; TaheriFard, Saloomeh";Recommendation algorithms for unstructured big data such as text, audio, image and video
"Robles-Morales, JM; Cordoba-Hernandez, AM";"Manuel Robles-Morales, Jose; Maria Cordoba-Hernandez, Ana";Digital Political Participation, Social Networks and Big Data Disintermediation in the Era of Web 2.0 Introduction
"Calvert, CL; Khoshgoftaar, TM";"Calvert, Chad L.; Khoshgoftaar, Taghi M.";Threshold Based Optimization of Performance Metrics with Severely Imbalanced Big Security Data
"Mehta, N; Pandit, A; Shukla, S";"Mehta, Nishita; Pandit, Anil; Shukla, Sharvari";Transforming healthcare with big data analytics and artificial intelligence: A systematic mapping study
"Barach, MA; Kaul, A; Leung, MD; Lu, SB";"Barach, Moshe A.; Kaul, Aseem; Leung, Ming D.; Lu, Sibo";Strategic Redundancy in the Use of Big Data: Evidence from a Two-Sided Labor Market
"She, R; Liu, S; Wan, S; Xiong, K; Fan, PY";"She, Rui; Liu, Shanyun; Wan, Shuo; Xiong, Ke; Fan, Pingyi";Importance of Small Probability Events in Big Data: Information Measures, Applications, and Challenges
"Bayati, M; Bhimani, J; Lee, R; Mi, NF";"Bayati, Mahsa; Bhimani, Janki; Lee, Ronald; Mi, Ningfang";Exploring Benefits of NVMe SSDs for BigData Processing in Enterprise Data Centers
"Wang, LL; Ding, JJ; Pan, L; Cao, DS; Jiang, H; Ding, XQ";"Wang, Liangliang; Ding, Junjie; Pan, Li; Cao, Dongsheng; Jiang, Hui; Ding, Xiaoqin";Artificial intelligence facilitates drug design in the big data era
Zhou, JR;Zhou, Jingren;Towards self-managing cloud-scale computing platforms: experiences and challenges
"Eken, S; Sayar, A";"Eken, Suleyman; Sayar, Ahmet";A MapReduce-Based Big Spatial Data Framework for Solving the Problem of Covering a Polygon with Orthogonal Rectangles
"Ju, XG; Lian, FY; Zhang, Y";"Ju, Xingang; Lian, Feiyu; Zhang, Yuan";Data Cleaning Optimization for Grain Big Data Processing using Task Merging
"Bu, FY; Wang, X; Gao, B";"Bu, Fanyu; Wang, Xin; Gao, Bo";A multi-projection deep computation model for smart data in Internet of Things
"Guo, A; Ma, JH; Wang, KIK";"Guo, Ao; Ma, Jianhua; Wang, Kevin I-Kai";Integrated Modeling of Personal Character Using Personal Big Data
Mathew, E;Mathew, Elezabeth;Big Data Analytics in E-procurement of a Chain Hotel
"Yin, JW; Yang, YL; Hong, WB; Cai, YF; Yu, XY";"Yin, Jianwei; Yang, Yinglin; Hong, Weibin; Cai, Yefan; Yu, Xiangyang";Portable Smart Spectrometer Integrated with Blockchain and Big Data Technology
"Chennu, R; Veeredhi, VR";"Chennu, Ranganayakulu; Veeredhi, Vasudeva Rao";Optimization of Aerospace Big Data Including Integrated Health Monitoring With the Help of Data Analytics
"Escobar, CA; Morales-Menendez, R";"Escobar, Carlos A.; Morales-Menendez, Ruben";Process-Monitoring-for-Quality - A Model Selection Criterion for Support Vector Machine
"van de Wetering, R; Mikalef, P; Krogstie, J";"van de Wetering, Rogier; Mikalef, Patrick; Krogstie, John";Big Data is Power: Business Value from a Process Oriented Analytics Capability
Fang, YG;Fang, Yigui;Research on the effectiveness of the English blended teaching in higher vocational colleges in the big data era
"Lohani, BP; Singh, A; Bibhu, V";"Lohani, Bhanu Prakash; Singh, Ajit; Bibhu, Vimal";A hybrid optimization approach using Evolutionary Computing and Map Reduce Architecture
Cui, LH;Cui, Lianhe;Complex industrial automation data stream mining algorithm based on random internet of robotic things
"Richter, AN; Khoshgoftaar, TM";"Richter, Aaron N.; Khoshgoftaar, Taghi M.";Approximating Learning Curves for Imbalanced Big Data with Limited Labels
Salhi, A;Salhi, Abdellah;A Data Privacy Preservation Approach and a Case Study in Data Analytics
Sandgaard, A;Sandgaard, Anders;Big data and data governance: From the 'world of ideas' to the 'world of practice'
"Wu, CR; Lee, V; McMurtrey, ME";"Wu, Chuanrong; Lee, Veronika; McMurtrey, Mark E.";Knowledge Composition and Its Influence on New Product Development Performance in the Big Data Environment
"Leung, CK; Eckhardt, LB; Sainbhi, AS; Tran, CTK; Wen, Q; Lee, W";"Leung, Carson K.; Eckhardt, Lucas B.; Sainbhi, Amanjyot Singh; Tran, Cong Thanh Kevin; Wen, Qi; Lee, Wookey";A Flexible Query Answering System for Movie Analytics
"Mehmood, I; Ullah, A; Muhammad, K; Deng, DJ; Meng, WZ; Al-Turjman, F; Sajjad, M; de Albuquerque, VHC";"Mehmood, Irfan; Ullah, Amin; Muhammad, Khan; Deng, Der-Jiunn; Meng, Weizhi; Al-Turjman, Fadi; Sajjad, Muhammad; de Albuquerque, Victor Hugo C.";Efficient Image Recognition and Retrieval on IoT-Assisted Energy-Constrained Platforms From Big Data Repositories
Dunlop, CA;Dunlop, Claire A.;Bracing for impact: is public administration ready to be relevant?
"Onyeka, E; Anu, V; Varde, AS";"Onyeka, Emebo; Anu, Vaibhav; Varde, Aparna S.";Identifying Implicit Requirements in SRS Big Data
Yi, JP;Yi Jinping;Analysis and Improvement Strategy for Profit Contribution of Bank Customer Under Big Data Background
"Peng, SC; Wang, GJ; Zhou, YM; Wan, C; Wang, C; Yu, S; Niu, JW";"Peng, Sancheng; Wang, Guojun; Zhou, Yongmei; Wan, Cong; Wang, Cong; Yu, Shui; Niu, Jianwei";An Immunization Framework for Social Networks Through Big Data Based Influence Modeling
"Weinlander, E; Talwar, N; Weizer, J; Saleem, S; Pershing, S; Stagg, B; Mwanza, JC; Lynch, A; Sugar, A; Lee, PP; Stein, JD";"Weinlander, Eric; Talwar, Nidhi; Weizer, Jennifer; Saleem, Sophia; Pershing, Suzann; Stagg, Brian; Mwanza, Jean-Claude; Lynch, Anne; Sugar, Alan; Lee, Paul P.; Stein, Joshua D.";Refining Metrics for Assessing the Quality of Care of Patients Undergoing Cataract Surgery for Use in Big Data Analyses
"Ottenbacher, KJ; Graham, JE; Fisher, SR";"Ottenbacher, Kenneth J.; Graham, James E.; Fisher, Steve R.";Data Science in Physical Medicine and Rehabilitation Opportunities and Challenges
"Kuhzady, S; Ghasemi, V";"Kuhzady, Salar; Ghasemi, Vahid";FACTORS INFLUENCING CUSTOMERS' SATISFACTION AND DISSATISFACTION WITH HOTELS: A TEXT-MINING APPROACH
Nielsen, K;Nielsen, Kurt;Big Data and Sensitive Data
"Bramantoro, A; Alzahrani, AA";"Bramantoro, Arif; Alzahrani, Ahmad A.";Data Citation Service for Wikipedia Articles
"Bhargavi, P; Jyothi, S";"Bhargavi, Peyakunta; Jyothi, Singaraju";Big Data and Internet of Things for Analysing and Designing Systems Based on Hyperspectral Images
"Olivola, CY; Moat, HS; Preis, T";"Olivola, Christopher Y.; Moat, Helen Susannah; Preis, Tobias";Using big data to map the relationship between time perspectives and economic outputs
"Zhang, Y; Wang, YG; Bai, YP; Li, YZ; Lv, ZY; Ding, HW";"Zhang, Yu; Wang, Yan-Ge; Bai, Yan-Ping; Li, Yong-Zhen; Lv, Zhao-Yong; Ding, Hong-Wei";A New Rockburst Experiment Data Compression Storage Algorithm Based on Big Data Technology
"Ben HajKacem, MA; Ben N'cir, CE; Essoussi, N";"Ben HajKacem, Mohamed Aymen; Ben N'cir, Chiheb-Eddine; Essoussi, Nadia";STiMR k-Means: An Efficient Clustering Method for Big Data
"Zhou, L; Cai, LJ; Jiang, L; Chen, LN";"Zhou, Long; Cai, Lingjia; Jiang, Lin; Chen, Lingna";Power Grid Enterprise Intelligent Risk Identification Model Considering Multi-Attribute and Low correlation Data
"Reimer, AP; Madigan, EA";"Reimer, Andrew P.; Madigan, Elizabeth A.";Veracity in big data: How good is good enough
Ma, GY;Ma, Guyue;Research on the construction of the scientific service system of university libraries in the era of the big data
"Bawatna, M; Green, B; Kovalev, S; Deinert, JC; Knodel, O; Spallek, RG";"Bawatna, Mohammed; Green, Bertram; Kovalev, Sergey; Deinert, Jan-Christoph; Knodel, Oliver; Spallek, Rainer G.";Research and Implementation of Efficient Parallel Processing of Big Data at TELBE User Facility
"Bawatna, M; Green, B; Kovalev, S; Deinert, JC; Knodel, O; Spallek, RG";"Bawatna, Mohammed; Green, Bertram; Kovalev, Sergey; Deinert, Jan-Christoph; Knodel, Oliver; Spallek, Rainer G.";Research and Implementation of Efficient Parallel Processing of Big Data at TELBE User Facility
"Oles, D; Nowak, Z";"Oles, Dominik; Nowak, Ziemowit";The Performance Analysis of Distributed Storage Systems Used in Scalable Web Systems
"Talavera-Llames, R; Perez-Chacon, R; Troncoso, A; Martinez-Alvarez, F";"Talavera-Llames, R.; Perez-Chacon, R.; Troncoso, A.; Martinez-Alvarez, F.";MV-kWNN: A novel multivariate and multi-output weighted nearest neighbours algorithm for big data time series forecasting
Ye, LQ;Ye, Lunqiang;Research on Balanced Scheduling Algorithm of Big Data in Network Under Cloud Computing
Yablonsky, SA;Yablonsky, Sergey A.;Multidimensional Data-Driven Artificial Intelligence Innovation
"Bang, CS; Baik, GH";"Bang, Chang Seok; Baik, Gwang Ho";Using big data to see the forest and the trees: endoscopic submucosal dissection of early gastric cancer in Korea
"Beste, S; Wyss, D";"Beste, Simon; Wyss, Dominik";Quantitative methods in democratic innovation research
"Kusimo, H; Oyedele, L; Akinade, O; Oyedele, A; Abioye, S; Agboola, A; Mohammed-Yakub, N";"Kusimo, Habeeb; Oyedele, Lukumon; Akinade, Olugbenga; Oyedele, Ahmed; Abioye, Sofiat; Agboola, Alirat; Mohammed-Yakub, Naimah";Optimisation of resource management in construction projects: a big data approach
Jaaskelainen, FD;de Montalvo Jaaskelainen, Federico;A reflection from the theory of fundamental rights on the secondary use of health data in the framework of Big Data
"Hadi, MS; Lawey, AQ; El-Gorashi, TEH; Elmirghani, JMH";"Hadi, Mohammed S.; Lawey, Ahmed Q.; El-Gorashi, Taisir E. H.; Elmirghani, Jaafar M. H.";Patient-Centric Cellular Networks Optimization Using Big Data Analytics
Daniel, BK;Daniel, Ben Kei;Artificial reality: The practice of analytics and big data in educational research
"Shchelykalina, S; Nikolaev, D; Bulanova, N";"Shchelykalina, Svetlana; Nikolaev, Dmitry; Bulanova, Natalia";Statistical Relationship of Overweight, Obesity and High Blood Pressure in Children Based on the Analysis of Russian Big Data
"D'Emilia, G; Gaspari, A; Natale, E";"D'Emilia, Giulio; Gaspari, Antonella; Natale, Emanuela";Mechatronics Applications of Measurements for Smart Manufacturing in an Industry 4.0 Scenario
"Yuan, ZH; Li, H; Li, X";"Yuan, Zhihao; Li, Hao; Li, Xian";Evidence Collection Agent Model Design for Big Data Forensic Analysis
"Acuna, CC; Garcia, AV";"Campos Acuna, Concepcion; Vaquero Garcia, Alberto";THE PORTAL OF LOCAL TRANSPARENCY OF GALICIA AND THE TECHNIQUES BIG DATA
"Chen, S; Luo, QQ";"Chen Shuang; Luo Qiqiang";Research on the Application of Computer Software Technology in the Era of Big Data
"Nieland, S; Krajzewicz, D";"Nieland, Simon; Krajzewicz, Daniel";Linking Uber travel time matrices to land use patterns. A comparative analysis of the cities Bogota and Paris
"Awaysheh, FM; Cabaleiro, JC; Pena, TF; Alazab, M";"Awaysheh, Feras M.; Cabaleiro, Jose C.; Pena, Tomas F.; Alazab, Mamoun";Big Data Security Frameworks Meet the Intelligent Transportation Systems Trust Challenges
"Oh, S; Kim, K; Lee, M";"Oh, Soyeon; Kim, Kyeongjoo; Lee, Minsoo";Analysis of Centrality Concepts Applied to Real-World Big Graph Data
"Shi, S; Fan, J";"Shi, Sen; Fan, Jie";Research on the change strategy of hospital informatization in the age of the cloud computing and the big data
"Del Campo, AG; Gazzola, P";"Gonzalez Del Campo, Ainhoa; Gazzola, Paola";Untapping the potential of technological advancements in Strategic Environmental Assessment
"Khatiwada, A; Kadariya, P; Agrahari, S; Dhakal, R";"Khatiwada, Aamod; Kadariya, Pradeep; Agrahari, Sandip; Dhakal, Rabin";Big Data Analytics and Deep Learning Based Sentiment Analysis System for Sales Prediction
Jiao, HL;Jiao, Hailong;The significance of network art resources to the art education in colleges and universities in the big data era
Wang, SQ;Wang, Shiqin;On the inheritance and development of the Tibetan weaving and embroidery art under the background of the big data
"Fan, E; Rowan, KM";"Fan, Eddy; Rowan, Kathryn M.";To Enjoy the FRUIT of Your Labors, Don't Forget to Look before You Leap!
Huang, A;Huang, Alice;The Era of Artificial Intelligence and Big Data Provides Knowledge Services for the Publishing Industry in China
"Kedra, J; Radstake, TRD; Pandit, A; Baraliakos, X; Berenbaum, F; Finckh, A; Fautrel, B; Stamm, T; Gomez-Cabrero, D; Pristipino, C; Choquet, R; Servy, H; Stones, S; Burmester, G; Gossec, L";"Kedra, Joanna; Radstake, Timothy R. D.; Pandit, Aridman; Baraliakos, Xenofon; Berenbaum, Francis; Finckh, Axel; Fautrel, Bruno; Stamm, Tanja; Gomez-Cabrero, David; Pristipino, Christian; Choquet, Remy; Servy, Herve; Stones, Simon; Burmester, Gerd; Gossec, Laure";The Current State of Big Data Use and Artificial Intelligence in RMDs: A Systematic Literature Review Informing EULAR Recommendations
Winter, D;Winter, David;The rise of the practitioner-researcher How big data and evidence-based practice requires practitioners with a research mindset
"Amato, F; Moscato, V; Picariello, A; Sperli'i, G";"Amato, Flora; Moscato, Vincenzo; Picariello, Antonio; Sperli'i, Giancarlo";Extreme events management using multimedia social networks
"Dahmani, D; Belalem, G; Rahal, SA";"Dahmani, Djilali; Belalem, Ghalem; Rahal, Sidi Ahmed";Processing of association rules with ontology in distributed NoSQL systems
"Rochd, Y; Hafidi, I; Ouartassi, B";"Rochd, Yassir; Hafidi, Imad; Ouartassi, Bajil";Parallel Implementation of PrePost Algorithm Based on Spark for Big Data
Prince, R;Prince, Russell;The geography of statistics: Social statistics from moral science to big data
"Sawadogo, PN; Scholly, E; Favre, C; Ferey, E; Loudcher, S; Darmont, J";"Sawadogo, Pegdwende N.; Scholly, Etienne; Favre, Cecile; Ferey, Eric; Loudcher, Sabine; Darmont, Jerome";Metadata Systems for Data Lakes: Models and Features
"Silva, PCDE; Lucas, PDE; Guimaraes, FG";"de Lima e Silva, Petronio Candido; de Oliveira e Lucas, Patricia; Guimaraes, Frederico Gadelha";A Distributed Algorithm for Scalable Fuzzy Time Series
"Hassani, H; Huang, X; Silva, ES";"Hassani, Hossein; Huang, Xu; Silva, Emmanuel Sirimal";Fusing Big Data, Blockchain, and Cryptocurrency
Liu, H;Liu, Hui;Design of Statistical Model for Difference of Leaf Color of Ornamental Begonia Based on Big Data Analysis
"Donthineni, P; Basu, S; Shanbhag, S";"Donthineni, Pragnya; Basu, Sayan; Shanbhag, Swapna";Incidence, Demographics, Types and Risk Factors of Dry Eye Disease in India: Electronic Medical Records Driven Big Data Analytics
"Matteussi, KJ; Zanchetta, BF; Bertoncello, G; Dos Santos, JDD; Dos Anjos, JCS; Geyer, CFR";"Matteussi, Kassiano J.; Zanchetta, Breno F.; Bertoncello, Germano; Dos Santos, Jobe D. D.; Dos Anjos, Julio C. S.; Geyer, Claudio F. R.";Analysis and Performance Evaluation of Deep Learning on Big Data
"Lin, L; Liang, W; Li, CF; Huang, XD; Lv, JW; Peng, H; Wang, BY; Zhu, BW; Sun, Y";"Lin, Li; Liang, Wei; Li, Chao-Feng; Huang, Xiao-Dan; Lv, Jia-Wei; Peng, Hao; Wang, Bing-Yi; Zhu, Bo-Wei; Sun, Ying";Development and implementation of a dynamically updated big data intelligence platform from electronic health records for nasopharyngeal carcinoma research
"Bannister, J; O'Sullivan, A; Bates, E";"Bannister, Jon; O'Sullivan, Anthony; Bates, Ellie";Place and time in the Criminology of Place
"Shefa, U; Jung, JY";"Shefa, Ulfuara; Jung, Junyang";Comparative study of microarray and experimental data on Schwann cells in peripheral nerve degeneration and regeneration: big data analysis
"Zlatev, Z; Hinov, N";"Zlatev, Zoran; Hinov, Nikolay";Signal Processing and Analysing Big Mass Data Using LabView
"Geng, LJ; Xue, YS; Hu, GY";"Geng, Lijiang; Xue, Yishu; Hu, Guanyu";Subsampled Information Criteria for Bayesian Model Selection in the Big Data Setting
"Bonatti, PA; Kirrane, S";"Bonatti, Piero A.; Kirrane, Sabrina";Big Data and Analytics in the Age of the GDPR
"Sariyar, M; Schlunder, I";"Sariyar, Murat; Schluender, Irene";Challenges and Legal Gaps of Genetic Profiling in the Era of Big Data
"Kharbouch, A; Naitmalek, Y; Elkhoukhi, H; Bakhouya, M; De Florio, V; El Ouadghiri, MD; Latre, S; Blondia, C";"Kharbouch, Abdelhak; Naitmalek, Youssef; Elkhoukhi, Hamza; Bakhouya, Mohamed; De Florio, Vincenzo; Driss El Ouadghiri, Moulay; Latre, Steven; Blondia, Chris";IoT and Big Data Technologies for Monitoring and Processing Real-Time Healthcare Data
"Wu, ML; Yuen, TH";"Wu, Mingli; Yuen, Tsz Hon";Securely Perturb Big Data by Using Inner Product
Jensen, WA;Jensen, Willis A.;Statistics = Analytics?
"Canizo, M; Conde, A; Charramendieta, S; Minon, R; Cid-Fuentes, RG; Onieva, E";"Canizo, Mikel; Conde, Angel; Charramendieta, Santiago; Minon, Raul; Cid-Fuentes, Raul G.; Onieva, Enrique";Implementation of a Large-Scale Platform for Cyber-Physical System Real-Time Monitoring
"Ai, PL; Liu, YY; Zhao, X";"Ai, Peilin; Liu, Yuanyuan; Zhao, Xi";Big Five personality traits predict daily spatial behavior: Evidence from smartphone data
"Tran, T; Tran, L; Mai, A";"Tuan Tran; Loc Tran; An Mai";K -Segments Under Bagging approach: An experimental Study on Extremely Imbalanced Data Classification
Cabanban-Casem, CL;Cabanban-Casem, Christianne Lynnette;Analytical Visualization of Higher Education Institutions' Big Data for Decision Making
"Milne, D; Watling, D";"Milne, Dave; Watling, David";Big data and understanding change in the context of planning transport systems
"Beckers, J; Vanhoof, M; Verhetsel, A";"Beckers, Joris; Vanhoof, Maarten; Verhetsel, Ann";Returning the particular: Understanding hierarchies in the Belgian logistics system
"He, ZZ; He, YH; Liu, FD; Zhao, YX";"He, Zhenzhen; He, Yihai; Liu, Fengdi; Zhao, Yixiao";Big Data-Oriented Product Infant Failure Intelligent Root Cause Identification Using Associated Tree and Fuzzy DEA
"Feng, YA; Zhou, P; Xu, J; Ji, SL; Wu, DP";"Feng, Yinan; Zhou, Pan; Xu, Jie; Ji, Shouling; Wu, Dapeng";Video Big Data Retrieval Over Media Cloud: A Context-Aware Online Learning Approach
Kagita, MK;Kagita, Mohan Krishna;Security and Privacy Issues for Business Intelligence In IOT
Diaz-Bone, R;Diaz-Bone, Rainer;Statistical Panopticism and Its Critique
Zhang, F;Zhang, Fan;Prediction and Evaluation of Urban Eco-sports Tourism Behavior Using Data Mining Technology
"Shirazi, F; Mohammadi, M";"Shirazi, Farid; Mohammadi, Mahbobeh";A big data analytics model for customer churn prediction in the retiree segment
"Lamb, J; Godbole, NS";"Lamb, John; Godbole, Nina S.";Smart Energy Efficiency for a Sustainable World
"Wang, F; Ma, C; Gao, HL; Kang, ZL";"Wang Fan; Ma Chao; Gao Huilin; Kang Zilu";A Framework for Automatic Collection and Updating of Honor & Black List Based on Big Data
"Balajadia, RA; Maglambayan, VLL; Pulido, MTR";"Balajadia, Rodalyn A.; Maglambayan, Vincent Louie L.; Pulido, Maria Teresa R.";Analysis of Filipino Mood Swings within a Day using Tweets
Bibri, SE;Bibri, Simon Elias;The Evolving Data-Driven Approach to Smart Sustainable Urbanism for Tackling the Conundrums of Sustainability and Urbanization
Thompson, P;Thompson, Paul;ENIGMA, BIG DATA, AND THE BRAIN: IMAGING AND GENOMICS OF 18 BRAIN DISEASES IN 50,000 INDIVIDUALS FROM 35 COUNTRIES
"Wang, HF; Cao, YP";"Wang, Haifeng; Cao, Yunpeng";Communication optimization of compute-intensive clusters based on software-defined networks
"Wang, SY; Yuan, JB; Li, X; Qian, ZZ; Arena, F; You, I";"Wang, Songyun; Yuan, Jiabin; Li, Xin; Qian, Zhuzhong; Arena, Fabio; You, Ilsun";Active Data Replica Recovery for Quality-Assurance Big Data Analysis in IC-IoT
"Ghosh, RE; Crellin, E; Beatty, S; Donegan, K; Myles, P; Williams, R";"Ghosh, Rebecca E.; Crellin, Elizabeth; Beatty, Sue; Donegan, Katherine; Myles, Puja; Williams, Rachael";How Clinical Practice Research Datalink data are used to support pharmacovigilance
"Dierick, K; Silver, A";"Dierick, K.; Silver, A.";APPLICATION OF BIG DATA IN RARE DISEASE MANAGEMENT: TREATMENT COST OF THERAPEUTIC PLASMA EXCHANGE VERSUS IMMUNOGLOBULINS IN AN INPATIENT SETTING
"Hussain, S; Hussain, M; Afzal, M; Hussain, J; Bang, J; Seung, H; Lee, S";"Hussain, Shujaat; Hussain, Maqbool; Afzal, Muhammad; Hussain, Jamil; Bang, Jaehun; Seung, Hyonwoo; Lee, Sungyoung";Semantic preservation of standardized healthcare documents in big data
"Villegas-Ch, W; Palacios-Pacheco, X; Lujan-Mora, S";"Villegas-Ch, William; Palacios-Pacheco, Xavier; Lujan-Mora, Sergio";Application of a Smart City Model to a Traditional University Campus with a Big Data Architecture: A Sustainable Smart Campus
"Ryu, GA; Lee, JW; Jeong, JS; Kim, M; Yoo, KH";"Ryu, Gae-A; Lee, Jae-Won; Jeong, Ji-Sung; Kim, Mihye; Yoo, Kwan-Hee";Real-Time Smart Safe-Return-Home Service Based on Big Data Analytics
"Zhang, LY; Meng, Q";"Zhang, Liye; Meng, Qiang";Probabilistic ship domain with applications to ship collision risk assessment
"Blasimme, A; Vayena, E; Van Hoyweghen, I";"Blasimme, Alessandro; Vayena, Effy; Van Hoyweghen, Ine";Big Data, precision medicine and private insurance: A delicate balancing act
"Li, W; Feng, CL; Jin, C; Chen, Q; Liu, HN; Zhao, DZ";"Li, Wei; Feng, Chaolu; Jin, Ci; Chen, Qiang; Liu, Haining; Zhao, Dazhe";A Two-level Cloud Storage System Based on Asynchronous Message for Medical Image Big Data
"Galetsi, P; Katsaliaki, K";"Galetsi, Panagiota; Katsaliaki, Korina";A review of the literature on big data analytics in healthcare
"Furtatova, A; Kamenik, L";"Furtatova, A.; Kamenik, L.";Predictive Analysis of Water Supply Based on Big Data
"Shah, S; Gochtovtt, A; Baldini, G";"Shah, Samir; Gochtovtt, Alexander; Baldini, Greg";Importance of Project Management in Business Analytics: Academia and Real World
"Sheng, SJ; Zhou, P; Wu, XD";"Sheng, Shaojing; Zhou, Peng; Wu, Xindong";CEPV: A Tree Structure Information Extraction and Visualization Tool for Big Knowledge Graph
"Lu, P; Nie, SZ";"Lu, Peng; Nie, Shizhao";The strength distribution and combined duration prediction of online collective actions: Big data analysis and BP neural networks
Tatonetti, NP;Tatonetti, Nicholas P.;Translational medicine in the Age of Big Data
"Schalk, B; Cuypers, M; van Gijssel, EB; Leusink, G";"Schalk, B.; Cuypers, M.; van Gijssel, E. B.; Leusink, G.";PEOPLE WITH INTELLECTUAL DISABILITIES AND CVD IN PRIMARY CARE: CURRENT STATUS
"Tadist, K; Najah, S; Nikolov, NS; Mrabti, F; Zahi, A";"Tadist, Khawla; Najah, Said; Nikolov, Nikola S.; Mrabti, Fatiha; Zahi, Azeddine";Feature selection methods and genomic big data: a systematic review
Bibri, SE;Bibri, Simon Elias;The Sciences Underlying Smart Sustainable Urbanism: Unprecedented Paradigmatic and Scholarly Shifts in Light of Big Data Science and Analytics
"Hossain, E; Khan, I; Un-Noor, F; Sikander, SS; Sunny, MSH";"Hossain, Eklas; Khan, Imtiaj; Un-Noor, Fuad; Sikander, Sarder Shazali; Sunny, Md Samiul Haque";Application of Big Data and Machine Learning in Smart Grid, and Associated Security Concerns: A Review
"Torres, JF; Troncoso, A; Koprinska, I; Wang, Z; Martinez-Alvarez, F";"Torres, J. F.; Troncoso, A.; Koprinska, I; Wang, Z.; Martinez-Alvarez, F.";Deep Learning for Big Data Time Series Forecasting Applied to Solar Power
"Tshimula, JM; Njuguna, MM; Bayala, TR; Didier, MM; Essemlali, A; Kanda, H; Ayuni, NS";"Tshimula, Jean Marie; Njuguna, Mary Muthoni; Bayala, Thierry Roger; Didier, Mbuyi Mukendi; Essemlali, Achraf; Kanda, Hugues; Ayuni, Numfor Solange";Sifting for Deeper Insights from Public Opinion: Towards Crowdsourcing and Big Data for Project Improvement
"Abbod, M; Shieh, JS";"Abbod, Maysam; Shieh, Jiann-Shing";Special Issue Advanced Signal Processing in Intelligent Systems for Health Monitoring
Tierney, TF;Tierney, T. F.;Big Data, Big Rhetoric in Toronto's Smart City
"Kong, E; Xia, YC";"Kong, Efang; Xia, Yingcun";ON THE EFFICIENCY OF ONLINE APPROACH TO NONPARAMETRIC SMOOTHING OF BIG DATA
Gong, WB;Gong, Weibo;Research on the strategic innovation of the government new media intervention in the social governance in the big data era
Scherz, P;Scherz, Paul;The Displacement of Human Judgment in Science: The Problems o Biomedical Research in an Age of Big Data
Ahmed, M;Ahmed, Mohiuddin;Intelligent Big Data Summarization for Rare Anomaly Detection
"Saneja, B; Rani, R";"Saneja, Bharti; Rani, Rinkle";A scalable correlation-based approach for outlier detection in wireless body sensor networks
"Li, AA; Guan, Y; Gong, H; Luo, QM";"Li, Anan; Guan, Yue; Gong, Hui; Luo, Qingming";Challenges of Processing and Analyzing Big Data in Mesoscopic Whole-brain Imaging
"Lin, YM; Wang, HZ; Li, JZ; Gao, H";"Lin, Yiming; Wang, Hongzhi; Li, Jianzhong; Gao, Hong";Data source selection for information integration in big data era
"Yang, CW; Clarke, K; Shekhar, S; Tao, CV";"Yang, Chaowei; Clarke, Keith; Shekhar, Shashi; Tao, C. Vincent";Big Spatiotemporal Data Analytics: a research and innovation frontier
Roberts, DE;Roberts, Dorothy E.;FOREWORD: ABOLITION CONSTITUTIONALISM
"Shanmugam, KP; Raju, M; Elkeeb, A; Ponnusamy, V";"Shanmugam, Krishna Prahalad; Raju, Murugesan; Elkeeb, Ahmed; Ponnusamy, Vikram";Investigating the Risk Factors for the Failure of Traditional Glaucoma Surgery Using Electronic Health Records and a Big Data Approach
"Mao, HY; Sun, Y";"Mao, Hongyi; Sun, Yang";A Way to Understand Inpatients Based on the Electronic Medical Records in the Big Data Environment (vol 2017, 9185686, 2017)
Bibri, SE;Bibri, Simon Elias;The Underlying Technological, Scientific, and Structural Dimensions of Data-Driven Smart Sustainable Cities and Their Socio-Political Shaping Factors and Issues
"Djenouri, Y; Lin, JCW; Djenouri, D; Belhadi, A; Fournier-Viger, P";"Djenouri, Youcef; Lin, Jerry Chun-Wei; Djenouri, Djamel; Belhadi, Asma; Fournier-Viger, Philippe";GBSO-RSS: GPU-Based BSO for Rules Space Summarization
"Jabbour, CJC; Jabbour, ABLD; Sarkis, J; Godinho, M";"Jabbour, Charbel Jose Chiappetta; Jabbour, Ana Beatriz Lopes de Sousa; Sarkis, Joseph; Godinho Filho, Moacir";Unlocking the circular economy through new business models based on large-scale data: An integrative framework and research agenda
